{
  "schema_version": "source-contract-v0",
  "source_id": "hf.models",
  "display_name": "Hugging Face Recently Updated Models",
  "enabled": true,
  "acquisition_class": "A_AUTHORITATIVE_STRUCTURED",
  "signal_roles": [
    "PRIMARY_EMISSION"
  ],
  "transport": "REST",
  "endpoint": {
    "url": "https://huggingface.co/api/models?sort=lastModified&limit=100&expand=author,createdAt,lastModified,pipeline_tag,sha,tags",
    "method": "GET",
    "accepted_content_types": [
      "application/json"
    ],
    "policy_profile": "structured-public-v0",
    "authentication": "NONE",
    "credential_ref": null
  },
  "expected_cadence": {
    "freshness_class": "F0",
    "poll_interval_seconds": 60
  },
  "policy": {
    "access_state": "ALLOWED",
    "browser_authorized": false,
    "raw_artifact_retention": "NONE",
    "extracted_text_retention": "BOUNDED_CANONICAL",
    "public_excerpt_mode": "METADATA_ONLY",
    "attribution_required": true,
    "policy_reviewed_at": "2026-09-05",
    "policy_references": [
      "https://huggingface.co/docs/hub/api",
      "https://huggingface.co/docs/hub/main/en/rate-limits",
      "https://huggingface.co/terms-of-service"
    ],
    "notes": "Public Hub metadata only; do not mirror model files/cards. Anonymous API limits are treated as dynamic source policy and 429 is a normal degraded transport outcome."
  },
  "capability": {
    "primary_evidence_eligible": true,
    "etag_support": "UNKNOWN",
    "last_modified_support": "UNKNOWN",
    "finite_window": true,
    "schema_reference": "https://huggingface.co/.well-known/openapi.json"
  }
}
