{
  "schema_version": "source-contract-v0",
  "source_id": "github.ml-repos",
  "display_name": "GitHub Machine Learning Repository Activity",
  "enabled": true,
  "acquisition_class": "A_AUTHORITATIVE_STRUCTURED",
  "signal_roles": [
    "BEHAVIORAL",
    "DISCOVERY"
  ],
  "transport": "REST",
  "endpoint": {
    "url": "https://api.github.com/search/repositories?q=topic%3Amachine-learning+fork%3Afalse+archived%3Afalse&sort=updated&order=desc&per_page=100",
    "method": "GET",
    "accepted_content_types": [
      "application/json"
    ],
    "policy_profile": "structured-public-v0",
    "authentication": "NONE",
    "credential_ref": null
  },
  "expected_cadence": {
    "freshness_class": "F2",
    "poll_interval_seconds": 900
  },
  "policy": {
    "access_state": "ALLOWED",
    "browser_authorized": false,
    "raw_artifact_retention": "NONE",
    "extracted_text_retention": "BOUNDED_CANONICAL",
    "public_excerpt_mode": "METADATA_ONLY",
    "attribution_required": true,
    "policy_reviewed_at": "2026-09-05",
    "policy_references": [
      "https://docs.github.com/en/rest/search/search",
      "https://docs.github.com/en/rest/using-the-rest-api/rate-limits-for-the-rest-api",
      "https://docs.github.com/en/site-policy/github-terms/github-terms-of-service"
    ],
    "notes": "Public repository metadata only. This lane is behavioral/discovery evidence, never factual confirmation. Volatile popularity counters are excluded from canonical identity; the finite search window is explicitly incomplete when saturated."
  },
  "capability": {
    "primary_evidence_eligible": false,
    "etag_support": "UNKNOWN",
    "last_modified_support": "UNKNOWN",
    "finite_window": true,
    "schema_reference": "https://docs.github.com/en/rest/search/search"
  }
}
