{
  "schema_version": "source-contract-v0",
  "source_id": "hn.frontpage",
  "display_name": "Hacker News Front Page",
  "enabled": true,
  "acquisition_class": "A_AUTHORITATIVE_STRUCTURED",
  "signal_roles": [
    "ATTENTION"
  ],
  "transport": "RSS",
  "endpoint": {
    "url": "https://news.ycombinator.com/rss",
    "method": "GET",
    "accepted_content_types": [
      "application/rss+xml",
      "application/xml",
      "text/xml"
    ],
    "policy_profile": "structured-public-v0",
    "authentication": "NONE",
    "credential_ref": null
  },
  "expected_cadence": {
    "freshness_class": "F1",
    "poll_interval_seconds": 300
  },
  "policy": {
    "access_state": "ALLOWED",
    "browser_authorized": false,
    "raw_artifact_retention": "NONE",
    "extracted_text_retention": "BOUNDED_CANONICAL",
    "public_excerpt_mode": "METADATA_ONLY",
    "attribution_required": true,
    "policy_reviewed_at": "2026-09-05",
    "policy_references": [
      "https://news.ycombinator.com/rss",
      "https://github.com/HackerNews/API"
    ],
    "notes": "Official HN front-page RSS is authoritative for HN attention only, not for factual truth of linked stories. The richer Firebase API remains a later fan-out option."
  },
  "capability": {
    "primary_evidence_eligible": false,
    "etag_support": "UNKNOWN",
    "last_modified_support": "UNKNOWN",
    "finite_window": true,
    "schema_reference": null
  }
}
